{
  "schemaVersion": "shuttle.proposal.v0.1",
  "kind": "InspectionComment",
  "caseId": "11111111-1111-4111-8111-111111111111",
  "expectedContentRevision": 1,
  "requestKey": "bbbbbbbb-bbbb-4bbb-8bbb-bbbbbbbbbbbb",
  "payload": {
    "artifactVersionId": "33333333-3333-4333-8333-333333333333",
    "artifactHash": "aaaaaaaaaaaaaaaaaaaaaaaaaaaaaaaaaaaaaaaaaaaaaaaaaaaaaaaaaaaaaaaa",
    "text": "Synthetic test comment: the governing process and evidence owner are still owed. This note is not an approval."
  }
}
