{
  "schemaVersion": "shuttle.proposal.v0.1",
  "kind": "PackDraft",
  "caseId": "11111111-1111-4111-8111-111111111111",
  "expectedContentRevision": 1,
  "requestKey": "aaaaaaaa-aaaa-4aaa-8aaa-aaaaaaaaaaaa",
  "payload": {
    "templateRelease": "readiness-gaps-public-v0.1",
    "skillRelease": "shuttle-public-v0.1",
    "sections": [
      {
        "key": "decision-brief",
        "title": "Decision brief",
        "text": "BLOCKED BY MISSING INPUTS. This synthetic pack identifies readiness gaps and requested next actions. It cannot support a positive bank readiness or launch decision.",
        "sourceIds": [
          "S01",
          "S03"
        ],
        "owedOwner": "the bank sponsor and the nominated digital co-owner"
      },
      {
        "key": "scope-and-facts",
        "title": "Scope and seven facts",
        "text": "F1 — Service and scenario: Read-only account-data-sharing readiness; no live service, payment initiation or launch. Owed owner: Digital co-owner, to be named by the bank sponsor\nF2 — Institution role: Fictional Bank Alpha is the LFI/data provider; the fictional app is the data recipient. Actual role selection is owed. Owed owner: the bank sponsor / digital co-owner\nF3 — Customer journey: A customer would permit account-summary display. Detailed segment, consent steps and exceptions are unspecified. Owed owner: Digital and consent/control owners\nF4 — Data and actions: Synthetic lab only; no actual identifiers, balances, credentials, consent grants or bank endpoints. Real data boundary and retention are owed. Owed owner: Digital and data-handling owners\nF5 — Parties and interfaces: Fictional bank and one fictional third-party app. No real counterparty or live interface evidence is supplied. Owed owner: Digital / technology owners\nF6 — Platform inheritance: No bank control is accepted as inherited. Applicable controls, policy releases, custodians and accepted evidence are unknown. Owed owner: Named control owner and evidence custodian\nF7 — Decision and ownership: Identify readiness gaps, owners and next actions. The governing process, reviewer and later decision authority remain unconfirmed. Owed owner: the bank sponsor coordinates; accountable bank owners decide",
        "sourceIds": [
          "S01",
          "S02",
          "S03"
        ]
      },
      {
        "key": "readiness-gaps",
        "title": "Readiness gaps and next actions",
        "text": "O01 Scope selection owed. O02 Consent journey and applicability evidence owed. O03 Real material blocked pending sharing permission. O04 User/file access NOT TESTED. O05 Operations owner and evidence owed. O06 Single-pack design review pending. O07 Governing process and authority owed. O08 Bank platform fit NOT PROVEN. These are illustrative discussion items, not regulatory obligations.",
        "sourceIds": [
          "S02",
          "S03",
          "S04"
        ],
        "owedOwner": "the bank sponsor coordinates the relevant bank owners; the lab operator owns technical lab evidence"
      },
      {
        "key": "inheritance",
        "title": "Inheritance and evidence",
        "text": "Unverified inheritance — evidence owed. No control identifier, applicable policy release, custodian or authorized evidence acceptance is supplied. An available document or receipt cannot prove a granted approval.",
        "sourceIds": [
          "S02",
          "S03"
        ],
        "owedOwner": "Named control owner and evidence custodian"
      },
      {
        "key": "provenance",
        "title": "Provenance and limits",
        "text": "S01–S04 are local synthetic/design sources frozen for this fixture. They establish no actual tenant identities, runtime artifact registration, bank policy acceptance or measured savings. The complete source register includes declared versions and local SHA-256 digests.",
        "sourceIds": [
          "S01",
          "S02",
          "S03",
          "S04"
        ]
      },
      {
        "key": "inspection",
        "title": "Inspection and outstanding decisions",
        "text": "No reviewer feedback has been received. AQ-01–08 remain pending: case/role/timing; decision/pack; people; permitted data; platform hard stops; process/inheritance; useful result; participation. Comments are append-only observations bound to an exact artifact and do not approve or amend the pack.",
        "sourceIds": [
          "S03",
          "S04"
        ],
        "owedOwner": "the bank sponsor and the nominated inspector"
      }
    ]
  }
}
